p-value,q-value,term_goid,term_category,term_level,pathway,members_input_overlap,members_input_overlap_geneids,size,effective_size,count,GeneRatio non-corrected,GeneRatio
0.00629382,0.12329039,GO:0007166,b,3,cell surface receptor signaling pathway,100; 347; 375; 578; 865; 960; 1019; 1436; 2185; 54994; 2634; 3071; 200081; 3486; 3557; 3716; 3929; 4087; 4615; 5159; 5284; 5295; 5327; 5657; 5698; 5716; 5788; 5792; 6386; 6464; 6801; 6850; 6907; 7076; 7204; 7341; 7409; 7412; 8737; 8898; 9111; 9454; 9564; 11167; 30011; 123169; 63893; 116985; 51466; 84632; 54206; 54726; 54829; 55759; 57126; 65125,PDGFRB; NCKAP1L; EVL; TIMP1; ERRFI1; SUMO1; OTUD4; SMAD2; SDCBP; RIPK1; PTK2B; LBP; APOD; AFAP1L2; ARAP1; LEO1; ARF1; CSF1R; VAV1; FSTL1; CBFB; PIK3R1; JAK1; PTPRC; HOMER3; MYD88; MTMR2; PRTN3; TRIO; SHC1; CD44; WNK1; GID8; TXLNA; PLAT; IGFBP3; PIGR; VCAM1; ADA; BCAR1; CD177; IL1RN; TBL1X; UBE2O; SYK; SH3KBP1; PSMD10; BAK1; PTPRF; WDR12; CDK4; STRN; PSMB9; GBP2; ASPN; NMI,3127,207,56,0.017908539,0.270531401
0.006464765,0.170140738,GO:0000228,c,4,nuclear chromosome,4173; 4176; 5393; 5977; 6117; 6119; 6598; 10111; 10286; 23212,DPF2; SMARCB1; RRS1; RPA1; RPA3; MCM7; MCM4; EXOSC9; RAD50; BCAS2,310,22,10,0.032258065,0.454545455
0.006464765,0.158632149,GO:0032102,b,5,negative regulation of response to external stimulus,100; 347; 947; 2629; 5327; 5627; 5788; 6558; 79626; 83481,APOD; TNFAIP8L2; GBA; CD34; SLC12A2; PROS1; PLAT; EPPK1; PTPRC; ADA,330,22,10,0.03030303,0.454545455
0.006528987,0.12329039,GO:0051239,b,3,regulation of multicellular organismal process,100; 347; 375; 478; 649; 865; 947; 1019; 1401; 1436; 1786; 1832; 2185; 2629; 3071; 3099; 3557; 3716; 3929; 4087; 4615; 5005; 5159; 5295; 5327; 5627; 5698; 5716; 5788; 5792; 5977; 22875; 6386; 6558; 6850; 7058; 7076; 8737; 8898; 9111; 9208; 9454; 9474; 9533; 9564; 9698; 80279; 114770; 83481; 123169; 51466; 84632; 85440; 54206; 54829; 55364; 23166; 92170; 30008; 65125,DPF2; PDGFRB; CRP; NCKAP1L; EVL; TIMP1; GBA; THBS2; CD34; DOCK7; SMAD2; SDCBP; RIPK1; PGLYRP2; PTK2B; POLR1C; STAB1; IMPACT; LBP; APOD; ATG5; LEO1; ARF1; DNMT1; CSF1R; AFAP1L2; MTG1; EPPK1; CBFB; PIK3R1; JAK1; CDK4; HOMER3; MYD88; MTMR2; EFEMP2; HK2; PROS1; ENPP4; SLC12A2; DSP; PLAT; ADA; BCAR1; PTPRC; LRRFIP1; IL1RN; ERRFI1; ORM2; BMP1; SYK; PSMD10; PTPRF; WNK1; PUM1; ATP1A3; PSMB9; CDK5RAP3; ASPN; NMI,3158,225,60,0.018999367,0.266666667
0.006723376,0.21290692,GO:0019208,m,3,phosphatase regulator activity,84687; 3486; 5504; 5514; 6305; 55291,PPP1R10; PPP1R2; SBF1; IGFBP3; PPP6R3; PPP1R9B,101,10,6,0.059405941,0.6
0.006723376,0.136036316,GO:0034113,b,4,heterotypic cell-cell adhesion,960; 1832; 3557; 5788; 7412; 65125,IL1RN; CD44; WNK1; DSP; PTPRC; VCAM1,60,10,6,0.1,0.6
0.006723376,0.158632149,GO:1903707,b,5,negative regulation of hemopoiesis,865; 2185; 5295; 5977; 114770; 123169,DPF2; LEO1; PGLYRP2; PTK2B; CBFB; PIK3R1,155,10,6,0.038709677,0.6
0.007050162,0.137415475,GO:0033628,b,4,regulation of cell adhesion mediated by integrin,100; 3071; 6850; 65125,SYK; WNK1; NCKAP1L; ADA,48,5,4,0.083333333,0.8
0.007050162,0.170140738,GO:0005657,c,4,replication fork,5984; 6117; 6119; 10286,BCAS2; RFC4; RPA1; RPA3,65,5,4,0.061538462,0.8
0.007050162,0.158632149,GO:1901658,b,5,glycosyl compound catabolic process,100; 1806; 2629; 22875,ENPP4; DPYD; GBA; ADA,49,5,4,0.081632653,0.8
0.007050162,0.158632149,GO:0022616,b,5,DNA strand elongation,4173; 4176; 5984; 10111,MCM7; RFC4; MCM4; RAD50,29,5,4,0.137931034,0.8
0.007270568,0.12329039,GO:0006959,b,3,humoral immune response,283; 712; 1401; 4153; 5199; 5627; 5657; 5788; 8993; 114770; 140683; 140823,CRP; ANG; BPIFA2; PROS1; C1QA; PGLYRP2; PGLYRP1; ROMO1; PTPRC; PRTN3; CFP; MBL2,402,29,12,0.029850746,0.413793103
0.007270568,0.137415475,GO:0007159,b,4,leukocyte cell-cell adhesion,100; 865; 960; 3071; 5295; 5788; 6850; 7409; 7412; 79626; 57126; 65125,NCKAP1L; TNFAIP8L2; SYK; CD44; WNK1; CD177; VAV1; CBFB; PTPRC; VCAM1; PIK3R1; ADA,354,29,12,0.033898305,0.413793103
0.00739982,0.12329039,GO:0048659,b,3,smooth muscle cell proliferation,283; 347; 1786; 3486; 4615; 5159; 30008,PDGFRB; APOD; ANG; EFEMP2; DNMT1; IGFBP3; MYD88,127,13,7,0.05511811,0.538461538
0.00739982,0.158632149,GO:0048660,b,5,regulation of smooth muscle cell proliferation,283; 347; 1786; 3486; 4615; 5159; 30008,PDGFRB; APOD; ANG; EFEMP2; DNMT1; IGFBP3; MYD88,125,13,7,0.056,0.538461538
0.007470693,0.137415475,GO:0042127,b,4,regulation of cell proliferation,100; 283; 347; 578; 1019; 1401; 1436; 1786; 2185; 54994; 84687; 3071; 3486; 4087; 4615; 5159; 5657; 5788; 6119; 6386; 6464; 6801; 6850; 7076; 7412; 9111; 83481; 54206; 57599; 140823; 26354; 30008; 65108,PDGFRB; CRP; NCKAP1L; PPP1R9B; TIMP1; ERRFI1; SMAD2; SDCBP; PTK2B; GNL3; APOD; WDR48; DNMT1; CSF1R; EPPK1; PTPRC; MYD88; PRTN3; MARCKSL1; ROMO1; SHC1; EFEMP2; GID8; IGFBP3; VCAM1; ADA; ANG; SYK; RPA3; BAK1; CDK4; STRN; NMI,1598,110,33,0.020650814,0.3
0.008318693,0.158632149,GO:1903037,b,5,regulation of leukocyte cell-cell adhesion,100; 865; 960; 3071; 5295; 5788; 6850; 7409; 7412; 79626; 65125,NCKAP1L; TNFAIP8L2; SYK; CD44; WNK1; VAV1; CBFB; PTPRC; VCAM1; PIK3R1; ADA,318,26,11,0.034591195,0.423076923
0.008340232,0.12329039,GO:0032623,b,3,interleukin-2 production,947; 5788; 9454,PTPRC; HOMER3; CD34,60,3,3,0.05,1
0.008340232,0.12329039,GO:0001562,b,3,response to protozoan,2634; 4615; 388646,GBP2; MYD88; GBP7,24,3,3,0.125,1
0.008340232,0.12329039,GO:0055094,b,3,response to lipoprotein particle,4864; 4615; 6850,SYK; NPC1; MYD88,29,3,3,0.103448276,1
0.008340232,0.12329039,GO:0071402,b,3,cellular response to lipoprotein particle stimulus,4864; 4615; 6850,SYK; NPC1; MYD88,30,3,3,0.1,1
0.008340232,0.12329039,GO:0032201,b,3,telomere maintenance via semi-conservative replication,5984; 6117; 6119,RFC4; RPA1; RPA3,27,3,3,0.111111111,1
0.008340232,0.144643456,GO:0060055,b,4,angiogenesis involved in wound healing,947; 4162; 6558,CD34; MCAM; SLC12A2,25,3,3,0.12,1
0.008340232,0.144643456,GO:0042832,b,4,defense response to protozoan,2634; 4615; 388646,GBP2; MYD88; GBP7,24,3,3,0.125,1
0.008340232,0.225746819,GO:0005540,m,4,hyaluronic acid binding,960; 1462; 23166,CD44; STAB1; VCAN,30,3,3,0.1,1
0.008340232,0.170140738,GO:0030686,c,4,90S preribosome,10607; 55759; 23246,WDR12; BOP1; TBL3,29,3,3,0.103448276,1
0.008340232,0.158632149,GO:0061042,b,5,vascular wound healing,947; 4162; 6558,CD34; MCAM; SLC12A2,17,3,3,0.176470588,1
0.008340232,0.158632149,GO:0032663,b,5,regulation of interleukin-2 production,947; 5788; 9454,PTPRC; HOMER3; CD34,58,3,3,0.051724138,1
0.008340232,0.158632149,GO:1990868,b,5,response to chemokine,2185; 6558; 65125,PTK2B; WNK1; SLC12A2,98,3,3,0.030612245,1
0.008340232,0.158632149,GO:0006297,b,5,"nucleotide-excision repair, DNA gap filling",5984; 6117; 6119,RFC4; RPA1; RPA3,24,3,3,0.125,1
0.008558189,0.158632149,GO:0051249,b,5,regulation of lymphocyte activation,100; 865; 3071; 4615; 5295; 5788; 6850; 7409; 7412; 79626; 114770; 388552; 30011,NCKAP1L; BLOC1S3; TNFAIP8L2; PGLYRP2; SYK; VAV1; CBFB; PTPRC; VCAM1; PIK3R1; ADA; MYD88; SH3KBP1,518,33,13,0.025096525,0.393939394
0.008962542,0.126969349,GO:0050878,b,3,regulation of body fluid levels,100; 947; 954; 2629; 3099; 5295; 5327; 5627; 5657; 22875; 6812; 6850; 7409; 9474; 57126; 388552,BLOC1S3; ENTPD2; GBA; HK2; PROS1; ENPP4; ATG5; CD34; VAV1; PLAT; STXBP1; SYK; PIK3R1; ADA; CD177; PRTN3,507,44,16,0.031558185,0.363636364
0.009042813,0.152471878,GO:0002684,b,4,positive regulation of immune system process,100; 338; 712; 865; 1401; 1436; 2185; 3071; 3929; 4153; 4615; 5199; 5295; 5627; 5698; 5716; 5788; 6812; 6850; 7409; 7412; 7941; 8737; 9111; 9564; 9698; 30011; 54726; 57126; 388552; 65125,CRP; NCKAP1L; OTUD4; PROS1; STXBP1; PTK2B; PUM1; MBL2; LBP; APOB; CSF1R; CD177; PLA2G7; CBFB; PIK3R1; MYD88; SH3KBP1; WNK1; VCAM1; ADA; BLOC1S3; BCAR1; RIPK1; SYK; PSMD10; C1QA; VAV1; PTPRC; PSMB9; CFP; NMI,1238,103,31,0.025040388,0.300970874
0.00996869,0.130359798,GO:0007276,b,3,gamete generation,283; 338; 1069; 1730; 2185; 2802; 6305; 9130; 9698; 10491; 114112; 57599,ANG; APOB; FAM50A; DIAPH2; WDR48; PUM1; CETN2; SBF1; PTK2B; GOLGA3; TXNRD3; CRTAP,701,30,12,0.017118402,0.4
0.00996869,0.130359798,GO:0007596,b,3,blood coagulation,947; 954; 5295; 5327; 5627; 5657; 22875; 6812; 6850; 7409; 57126; 388552,BLOC1S3; ENTPD2; SYK; CD34; ENPP4; PROS1; CD177; PLAT; STXBP1; VAV1; PIK3R1; PRTN3,344,30,12,0.034883721,0.4
0.00996869,0.160038766,GO:0007599,b,4,hemostasis,947; 954; 5295; 5327; 5627; 5657; 22875; 6812; 6850; 7409; 57126; 388552,BLOC1S3; ENTPD2; SYK; CD34; ENPP4; PROS1; CD177; PLAT; STXBP1; VAV1; PIK3R1; PRTN3,348,30,12,0.034482759,0.4